URL,Version,Status,OIDs,Name,Title,Description,Used
http://dicom.nema.org/resources/ontology/DCM,01,active,"1.2.840.10008.2.16.4",DICOM Controlled Terminology Definitions,,"DICOM Code Definitions (Coding Scheme Designator ""DCM"" Coding Scheme Version ""01"")","ValueSet/dicom-cid-29-AcquisitionModality"
http://hl7.org/fhir/CodeSystem/medication-statement-status,4.0.1,draft,"2.16.840.1.113883.4.642.4.1379",Medication Status Codes,Medication  status  codes,"Medication Status Codes","ValueSet/medication-statement-status"
http://hl7.org/fhir/CodeSystem/medication-status,4.0.1,draft,"2.16.840.1.113883.4.642.4.1380",Medication Status Codes,Medication  status  codes,"Medication Status Codes","ValueSet/medication-status"
http://hl7.org/fhir/CodeSystem/medicationrequest-intent,4.0.1,draft,"2.16.840.1.113883.4.642.4.1378",medicationRequest Intent,Medication request  intent,"MedicationRequest Intent Codes","ValueSet/medicationrequest-intent"
http://hl7.org/fhir/CodeSystem/medicationrequest-status,4.0.1,draft,"2.16.840.1.113883.4.642.4.1377",medicationrequest Status,Medicationrequest  status,"MedicationRequest Status Codes","ValueSet/medicationrequest-status"
http://hl7.org/fhir/CodeSystem/task-code,4.0.1,active,"2.16.840.1.113883.4.642.4.1397",TaskCode,Task Codes,"Codes indicating the type of action that is expected to be performed","ValueSet/task-code"
http://hl7.org/fhir/account-status,4.0.1,draft,"2.16.840.1.113883.4.642.4.727",AccountStatus,AccountStatus,"Indicates whether the account is available to be used.","ValueSet/account-status"
http://hl7.org/fhir/address-type,4.0.1,active,"2.16.840.1.113883.4.642.4.70",AddressType,AddressType,"The type of an address (physical / postal).","ValueSet/address-type"
http://hl7.org/fhir/address-use,4.0.1,active,"2.16.840.1.113883.4.642.4.68",AddressUse,AddressUse,"The use of an address.","ValueSet/address-use"
http://hl7.org/fhir/administrative-gender,4.0.1,active,"2.16.840.1.113883.4.642.4.2",AdministrativeGender,AdministrativeGender,"The gender of a person used for administrative purposes.","ValueSet/administrative-gender"
http://hl7.org/fhir/allergy-intolerance-category,4.0.1,draft,"2.16.840.1.113883.4.642.4.134",AllergyIntoleranceCategory,AllergyIntoleranceCategory,"Category of an identified substance associated with allergies or intolerances.","ValueSet/allergy-intolerance-category"
http://hl7.org/fhir/allergy-intolerance-criticality,4.0.1,draft,"2.16.840.1.113883.4.642.4.130",AllergyIntoleranceCriticality,AllergyIntoleranceCriticality,"Estimate of the potential clinical harm, or seriousness, of a reaction to an identified substance.","ValueSet/allergy-intolerance-criticality"
http://hl7.org/fhir/allergy-intolerance-type,4.0.1,draft,"2.16.840.1.113883.4.642.4.132",AllergyIntoleranceType,AllergyIntoleranceType,"Identification of the underlying physiological mechanism for a Reaction Risk.","ValueSet/allergy-intolerance-type"
http://hl7.org/fhir/care-plan-activity-status,4.0.1,draft,"2.16.840.1.113883.4.642.4.147",CarePlanActivityStatus,CarePlanActivityStatus,"Codes that reflect the current state of a care plan activity within its overall life cycle.","ValueSet/care-plan-activity-status"
http://hl7.org/fhir/chargeitem-status,4.0.1,draft,"2.16.840.1.113883.4.642.4.847",ChargeItemStatus,ChargeItemStatus,"Codes identifying the lifecycle stage of a ChargeItem.","ValueSet/chargeitem-status"
http://hl7.org/fhir/claim-use,4.0.1,draft,"2.16.840.1.113883.4.642.4.545",Use,Use,"The purpose of the Claim: predetermination, preauthorization, claim.","ValueSet/claim-use"
http://hl7.org/fhir/composition-attestation-mode,4.0.1,draft,"2.16.840.1.113883.4.642.4.239",CompositionAttestationMode,CompositionAttestationMode,"The way in which a person authenticated a composition.","ValueSet/composition-attestation-mode"
http://hl7.org/fhir/composition-status,4.0.1,draft,"2.16.840.1.113883.4.642.4.242",CompositionStatus,CompositionStatus,"The workflow/clinical status of the composition.","ValueSet/composition-status"
http://hl7.org/fhir/days-of-week,4.0.1,active,"2.16.840.1.113883.4.642.4.513",DaysOfWeek,DaysOfWeek,"The days of the week.","ValueSet/days-of-week"
http://hl7.org/fhir/diagnostic-report-status,4.0.1,draft,"2.16.840.1.113883.4.642.4.236",DiagnosticReportStatus,DiagnosticReportStatus,"The status of the diagnostic report.","ValueSet/diagnostic-report-status"
http://hl7.org/fhir/document-reference-status,4.0.1,draft,"2.16.840.1.113883.4.642.4.8",DocumentReferenceStatus,DocumentReferenceStatus,"The status of the document reference.","ValueSet/document-reference-status"
http://hl7.org/fhir/document-relationship-type,4.0.1,draft,"2.16.840.1.113883.4.642.4.245",DocumentRelationshipType,DocumentRelationshipType,"The type of relationship between documents.","ValueSet/document-relationship-type"
http://hl7.org/fhir/eligibilityrequest-purpose,4.0.1,draft,"2.16.840.1.113883.4.642.4.1183",EligibilityRequestPurpose,EligibilityRequestPurpose,"A code specifying the types of information being requested.","ValueSet/eligibilityrequest-purpose"
http://hl7.org/fhir/eligibilityresponse-purpose,4.0.1,draft,"2.16.840.1.113883.4.642.4.1185",EligibilityResponsePurpose,EligibilityResponsePurpose,"A code specifying the types of information being requested.","ValueSet/eligibilityresponse-purpose"
http://hl7.org/fhir/encounter-location-status,4.0.1,draft,"2.16.840.1.113883.4.642.4.263",EncounterLocationStatus,EncounterLocationStatus,"The status of the location.","ValueSet/encounter-location-status"
http://hl7.org/fhir/encounter-status,4.0.1,draft,"2.16.840.1.113883.4.642.4.247",EncounterStatus,EncounterStatus,"Current state of the encounter.","ValueSet/encounter-status"
http://hl7.org/fhir/episode-of-care-status,4.0.1,draft,"2.16.840.1.113883.4.642.4.665",EpisodeOfCareStatus,EpisodeOfCareStatus,"The status of the episode of care.","ValueSet/episode-of-care-status"
http://hl7.org/fhir/event-status,4.0.1,draft,"2.16.840.1.113883.4.642.4.110",EventStatus,EventStatus,"Codes identifying the lifecycle stage of an event.","ValueSet/immunization-status,ValueSet/event-status,ValueSet/clinicalimpression-status"
http://hl7.org/fhir/fm-status,4.0.1,draft,"2.16.840.1.113883.4.642.4.593",FinancialResourceStatusCodes,Financial Resource Status Codes,"This value set includes Status codes.","ValueSet/fm-status"
http://hl7.org/fhir/goal-status,4.0.1,draft,"2.16.840.1.113883.4.642.4.272",GoalLifecycleStatus,GoalLifecycleStatus,"Codes that reflect the current state of a goal and whether the goal is still being targeted.","ValueSet/goal-status"
http://hl7.org/fhir/history-status,4.0.1,draft,"2.16.840.1.113883.4.642.4.268",FamilyHistoryStatus,FamilyHistoryStatus,"A code that identifies the status of the family history record.","ValueSet/history-status"
http://hl7.org/fhir/identifier-use,4.0.1,active,"2.16.840.1.113883.4.642.4.58",IdentifierUse,IdentifierUse,"Identifies the purpose for this identifier, if known .","ValueSet/identifier-use"
http://hl7.org/fhir/imagingstudy-status,4.0.1,draft,"2.16.840.1.113883.4.642.4.991",ImagingStudyStatus,ImagingStudyStatus,"The status of the ImagingStudy.","ValueSet/imagingstudy-status"
http://hl7.org/fhir/invoice-priceComponentType,4.0.1,draft,"2.16.840.1.113883.4.642.4.869",InvoicePriceComponentType,InvoicePriceComponentType,"Codes indicating the kind of the price component.","ValueSet/invoice-priceComponentType"
http://hl7.org/fhir/invoice-status,4.0.1,draft,"2.16.840.1.113883.4.642.4.867",InvoiceStatus,InvoiceStatus,"Codes identifying the lifecycle stage of an Invoice.","ValueSet/invoice-status"
http://hl7.org/fhir/issue-severity,4.0.1,active,"2.16.840.1.113883.4.642.4.409",IssueSeverity,IssueSeverity,"How the issue affects the success of the action.","ValueSet/issue-severity"
http://hl7.org/fhir/issue-type,4.0.1,active,"2.16.840.1.113883.4.642.4.411",IssueType,IssueType,"A code that describes the type of issue.","ValueSet/issue-type"
http://hl7.org/fhir/item-type,4.0.1,draft,"2.16.840.1.113883.4.642.4.445",QuestionnaireItemType,QuestionnaireItemType,"Distinguishes groups from questions and display text and indicates data type for questions.","ValueSet/item-type"
http://hl7.org/fhir/link-type,4.0.1,active,"2.16.840.1.113883.4.642.4.424",LinkType,LinkType,"The type of link between this patient resource and another patient resource.","ValueSet/link-type"
http://hl7.org/fhir/list-mode,4.0.1,draft,"2.16.840.1.113883.4.642.4.319",ListMode,ListMode,"The processing mode that applies to this list.","ValueSet/list-mode"
http://hl7.org/fhir/list-status,4.0.1,draft,"2.16.840.1.113883.4.642.4.327",ListStatus,ListStatus,"The current state of the list.","ValueSet/list-status"
http://hl7.org/fhir/location-mode,4.0.1,draft,"2.16.840.1.113883.4.642.4.331",LocationMode,LocationMode,"Indicates whether a resource instance represents a specific location or a class of locations.","ValueSet/location-mode"
http://hl7.org/fhir/location-status,4.0.1,draft,"2.16.840.1.113883.4.642.4.333",LocationStatus,LocationStatus,"Indicates whether the location is still in use.","ValueSet/location-status"
http://hl7.org/fhir/name-use,4.0.1,active,"2.16.840.1.113883.4.642.4.66",NameUse,NameUse,"The use of a human name.","ValueSet/name-use"
http://hl7.org/fhir/narrative-status,4.0.1,draft,"2.16.840.1.113883.4.642.4.56",NarrativeStatus,NarrativeStatus,"The status of a resource narrative.","ValueSet/narrative-status"
http://hl7.org/fhir/note-type,4.0.1,draft,"2.16.840.1.113883.4.642.4.16",NoteType,NoteType,"The presentation types of notes.","ValueSet/note-type"
http://hl7.org/fhir/observation-status,4.0.1,active,"2.16.840.1.113883.4.642.4.401",ObservationStatus,ObservationStatus,"Codes providing the status of an observation.","ValueSet/observation-status"
http://hl7.org/fhir/publication-status,4.0.1,active,"2.16.840.1.113883.4.642.4.4",PublicationStatus,PublicationStatus,"The lifecycle status of an artifact.","ValueSet/publication-status"
http://hl7.org/fhir/questionnaire-answers-status,4.0.1,draft,"2.16.840.1.113883.4.642.4.448",QuestionnaireResponseStatus,QuestionnaireResponseStatus,"Lifecycle status of the questionnaire response.","ValueSet/questionnaire-answers-status"
http://hl7.org/fhir/questionnaire-enable-behavior,4.0.1,draft,"2.16.840.1.113883.4.642.4.1008",EnableWhenBehavior,EnableWhenBehavior,"Controls how multiple enableWhen values are interpreted -  whether all or any must be true.","ValueSet/questionnaire-enable-behavior"
http://hl7.org/fhir/questionnaire-enable-operator,4.0.1,draft,"2.16.840.1.113883.4.642.4.1006",QuestionnaireItemOperator,QuestionnaireItemOperator,"The criteria by which a question is enabled.","ValueSet/questionnaire-enable-operator"
http://hl7.org/fhir/reaction-event-severity,4.0.1,draft,"2.16.840.1.113883.4.642.4.136",AllergyIntoleranceSeverity,AllergyIntoleranceSeverity,"Clinical assessment of the severity of a reaction event as a whole, potentially considering multiple different manifestations.","ValueSet/reaction-event-severity"
http://hl7.org/fhir/remittance-outcome,4.0.1,draft,"2.16.840.1.113883.4.642.4.14",ClaimProcessingCodes,Claim Processing Codes,"This value set includes Claim Processing Outcome codes.","ValueSet/remittance-outcome"
http://hl7.org/fhir/request-intent,4.0.1,draft,"2.16.840.1.113883.4.642.4.114",RequestIntent,RequestIntent,"Codes indicating the degree of authority/intentionality associated with a request.","ValueSet/request-intent,ValueSet/task-intent,ValueSet/care-plan-intent"
http://hl7.org/fhir/request-priority,4.0.1,draft,"2.16.840.1.113883.4.642.4.116",RequestPriority,RequestPriority,"Identifies the level of importance to be assigned to actioning the request.","ValueSet/request-priority"
http://hl7.org/fhir/request-status,4.0.1,draft,"2.16.840.1.113883.4.642.4.112",RequestStatus,RequestStatus,"Codes identifying the lifecycle stage of a request.","ValueSet/request-status"
http://hl7.org/fhir/resource-types,4.0.1,active,,ResourceType,ResourceType,"One of the resource types defined as part of this version of FHIR.","ValueSet/resource-types,ValueSet/care-plan-activity-kind"
http://hl7.org/fhir/sid/ex-icd-10-procedures,4.0.1,draft,"2.16.840.1.113883.4.642.4.575",ICD-10ProcedureCodes,ICD-10 Procedure Codes,"This value set includes sample ICD-10 Procedure codes.","ValueSet/icd-10-procedures"
http://hl7.org/fhir/sid/icd-10,0.1.0,active,,ICD10,ICD-10 Codes (2010),"Set of ICD-10 Codes (2010) used in SATUSEHAT","ValueSet/icd-10"
http://hl7.org/fhir/specimen-status,4.0.1,draft,"2.16.840.1.113883.4.642.4.472",SpecimenStatus,SpecimenStatus,"Codes providing the status/availability of a specimen.","ValueSet/specimen-status"
http://hl7.org/fhir/substance-status,4.0.1,draft,"2.16.840.1.113883.4.642.4.475",FHIRSubstanceStatus,FHIRSubstanceStatus,"A code to indicate if the substance is actively used.","ValueSet/substance-status"
http://hl7.org/fhir/task-intent,4.0.1,draft,"2.16.840.1.113883.4.642.4.1241",TaskIntent,TaskIntent,"Distinguishes whether the task is a proposal, plan or full order.","ValueSet/task-intent"
http://hl7.org/fhir/task-status,4.0.1,draft,"2.16.840.1.113883.4.642.4.791",TaskStatus,TaskStatus,"The current status of the task.","ValueSet/task-status"
http://hl7.org/fhir/uv/genomics-reporting/CodeSystem/tbd-codes-cs,0.1.0,draft,,TbdCodesCS,To Be Determined Codes,"To Be Determined codes from Genomics Reporting","ValueSet/tbd-codes-vs"
http://loinc.org,0.1.0,draft,,LOINCCodesCS,LOINC Codes Collection,"Collection of LOINC codes used in the system","ValueSet/c80-doc-typecodes,ValueSet/antimicrobial-resistance-vs,ValueSet/report-codes,ValueSet/questionnaire-questions,ValueSet/observation-codes,ValueSet/document-classcodes,ValueSet/doc-section-codes,ValueSet/doc-typecodes"
http://snomed.info/sct,0.1.0,draft,,SNOMEDCTCS,SNOMED CT Codes,"SNOMED Clinical Terms codes","ValueSet/servicerequest-category,ValueSet/specimen-container-type,ValueSet/procedure-followup,ValueSet/supplement-type,ValueSet/specimen-collection-method,ValueSet/texture-code,ValueSet/medication-form-codes,ValueSet/body-site,ValueSet/manifestation-or-symptom,ValueSet/goal-start-event,ValueSet/procedure-code,ValueSet/modified-foodtype,ValueSet/medication-as-needed-reason,ValueSet/reason-medication-status-codes,ValueSet/c80-facilitycodes,ValueSet/immunization-reason,ValueSet/substance-code,ValueSet/allergyintolerance-code,ValueSet/care-plan-category,ValueSet/observation-methods,ValueSet/questionnaire-answers,ValueSet/servicerequest-orderdetail,ValueSet/entformula-type,ValueSet/bodysite-laterality,ValueSet/investigation-sets,ValueSet/condition-stage,ValueSet/clinical-findings,ValueSet/encounter-reason,ValueSet/immunization-target-disease,ValueSet/participant-role,ValueSet/nutrient-code,ValueSet/clinicalimpression-prognosis,ValueSet/approach-site-codes,ValueSet/device-action,ValueSet/medication-codes,ValueSet/diet-type,ValueSet/reason-medication-not-given-codes,ValueSet/device-kind,ValueSet/performer-role,ValueSet/antimicrobial-resistance-vs,ValueSet/food-type,ValueSet/c80-practice-codes,ValueSet/referencerange-appliesto,ValueSet/route-codes,ValueSet/procedure-outcome,ValueSet/procedure-reason,ValueSet/care-plan-activity-outcome,ValueSet/procedure-category,ValueSet/condition-code,ValueSet/practitioner-role,ValueSet/condition-stage-type,ValueSet/consistency-type,ValueSet/procedure-not-performed-reason,ValueSet/immunization-status-reason,ValueSet/condition-outcome,ValueSet/administration-method-codes,ValueSet/condition-severity"
http://terminology.hl7.org/CodeSystem/FDI-surface,1.0.0,draft,"2.16.840.1.113883.4.642.1.1154",SurfaceCodes,Surface Codes,"This value set includes a smattering of FDI tooth surface codes.","ValueSet/surface"
http://terminology.hl7.org/CodeSystem/adjudication,1.0.1,active,"2.16.840.1.113883.4.642.1.1171",AdjudicationValueCodes,Adjudication Value Codes,"This value set includes a smattering of Adjudication Value codes which includes codes to indicate the amounts eligible under the plan, the amount of benefit, copays etc.","ValueSet/adjudication"
http://terminology.hl7.org/CodeSystem/adjudication-error,1.0.1,active,"2.16.840.1.113883.4.642.1.1053",AdjudicationErrorCodes,Adjudication Error Codes,"This value set includes a smattering of adjudication codes.","ValueSet/adjudication-error"
http://terminology.hl7.org/CodeSystem/adjudication-reason,1.0.1,active,"2.16.840.1.113883.4.642.1.1172",AdjudicationReasonCodes,Adjudication Reason Codes,"This value set includes smattering of Adjudication Reason codes.","ValueSet/adjudication-reason"
http://terminology.hl7.org/CodeSystem/admit-source,1.0.1,active,"2.16.840.1.113883.4.642.1.1092",AdmitSource,Admit source,"This value set defines a set of codes that can be used to indicate from where the patient came in.","ValueSet/encounter-admit-source"
http://terminology.hl7.org/CodeSystem/allergyintolerance-clinical,1.0.1,active,"2.16.840.1.113883.4.642.1.1373",AllergyIntoleranceClinicalStatusCodes,AllergyIntolerance Clinical Status Codes,"Preferred value set for AllergyIntolerance Clinical Status.","ValueSet/allergyintolerance-clinical"
http://terminology.hl7.org/CodeSystem/allergyintolerance-verification,1.0.1,active,"2.16.840.1.113883.4.642.1.1371",AllergyIntoleranceVerificationStatus,AllergyIntolerance Verification Status,"The verification status to support or decline the clinical status of the allergy or intolerance.","ValueSet/allergyintolerance-verification"
http://terminology.hl7.org/CodeSystem/benefit-network,2.0.0,active,"2.16.840.1.113883.4.642.1.1177",NetworkTypeCodes,Network Type Codes,"This code system represents the contractual relationship between a provider and payer for administrative purposes for a specific patient, service, or product.","ValueSet/benefit-network"
http://terminology.hl7.org/CodeSystem/benefit-term,1.0.1,active,"2.16.840.1.113883.4.642.1.1179",BenefitTermCodes,Benefit Term Codes,"This value set includes a smattering of Benefit Term codes.","ValueSet/benefit-term"
http://terminology.hl7.org/CodeSystem/benefit-type,1.0.1,active,"2.16.840.1.113883.4.642.1.1176",BenefitTypeCodes,Benefit Type Codes,"This value set includes a smattering of Benefit type codes.","ValueSet/benefit-type"
http://terminology.hl7.org/CodeSystem/benefit-unit,1.0.1,active,"2.16.840.1.113883.4.642.1.1178",UnitTypeCodes,Unit Type Codes,"This value set includes a smattering of Unit type codes.","ValueSet/benefit-unit"
http://terminology.hl7.org/CodeSystem/chargeitem-billingcodes,1.0.1,active,"2.16.840.1.113883.4.642.1.1257",ChargeItemCode,ChargeItemCode,"Example set of codes that can be used for billing purposes.","ValueSet/chargeitem-billingcodes"
http://terminology.hl7.org/CodeSystem/claim-exception,1.0.1,active,"2.16.840.1.113883.4.642.1.1162",ExceptionCodes,Exception Codes,"This value set includes sample Exception codes.","ValueSet/claim-exception"
http://terminology.hl7.org/CodeSystem/claim-type,1.0.1,active,"2.16.840.1.113883.4.642.1.1156",ClaimTypeCodes,Claim Type Codes,"This value set includes Claim Type codes.","ValueSet/claim-type"
http://terminology.hl7.org/CodeSystem/claimcareteamrole,1.0.1,active,"2.16.840.1.113883.4.642.1.1165",ClaimCareTeamRoleCodes,Claim Care Team Role Codes,"Claim roles of the care team members providing products and services.","ValueSet/claim-careteamrole"
http://terminology.hl7.org/CodeSystem/claiminformationcategory,1.0.1,active,"2.16.840.1.113883.4.642.1.1163",ClaimInformationCategoryCodes,Claim Information Category Codes,"This value set includes sample Information Category codes.","ValueSet/claim-informationcategory"
http://terminology.hl7.org/CodeSystem/common-tags,1.0.1,active,"2.16.840.1.113883.4.642.1.1067",CommonTags,Common Tags,"Common Tag Codes defined by FHIR project","ValueSet/common-tags"
http://terminology.hl7.org/CodeSystem/condition-category,2.0.0,active,"2.16.840.1.113883.4.642.1.1073",ConditionCategoryCodes,Condition Category Codes,"Preferred value set for Condition Categories.","ValueSet/condition-category"
http://terminology.hl7.org/CodeSystem/condition-clinical,3.0.0,active,"2.16.840.1.113883.4.642.1.1074",ConditionClinicalStatusCodes,Condition Clinical Status Codes,"Preferred value set for Condition Clinical Status.","ValueSet/condition-clinical"
http://terminology.hl7.org/CodeSystem/condition-ver-status,2.0.1,active,"2.16.840.1.113883.4.642.1.1075",ConditionVerificationStatus,ConditionVerificationStatus,"The verification status to support or decline the clinical status of the condition or diagnosis.","ValueSet/condition-ver-status"
http://terminology.hl7.org/CodeSystem/contactentity-type,1.0.0,draft,"2.16.840.1.113883.4.642.1.1129",ContactEntityType,Contact entity type,"This example value set defines a set of codes that can be used to indicate the purpose for which you would contact a contact party.","ValueSet/contactentity-type"
http://terminology.hl7.org/CodeSystem/coverage-class,1.0.1,active,"2.16.840.1.113883.4.642.1.1147",CoverageClassCodes,Coverage Class Codes,"This value set includes Coverage Class codes.","ValueSet/coverage-class"
http://terminology.hl7.org/CodeSystem/coverage-copay-type,1.0.1,active,"2.16.840.1.113883.4.642.1.1149",CoverageCopayTypeCodes,Coverage Copay Type Codes,"This value set includes sample Coverage Copayment Type codes.","ValueSet/coverage-copay-type"
http://terminology.hl7.org/CodeSystem/coverage-selfpay,1.0.1,active,"2.16.840.1.113883.4.642.1.1148",CoverageSelfPayCodes,Coverage SelfPay Codes,"This value set includes Coverage SelfPay codes.","ValueSet/coverage-type"
http://terminology.hl7.org/CodeSystem/coverageeligibilityresponse-ex-auth-support,1.0.1,active,"2.16.840.1.113883.4.642.1.1394",CoverageEligibilityResponseAuthSupportCodes,CoverageEligibilityResponse Auth Support Codes,"This value set includes CoverageEligibilityResponse Auth Support codes.","ValueSet/coverageeligibilityresponse-ex-auth-support"
http://terminology.hl7.org/CodeSystem/data-absent-reason,1.0.0,active,"2.16.840.1.113883.4.642.4.1048",DataAbsentReason,DataAbsentReason,"Used to specify why the normally expected content of the data element is missing.","ValueSet/data-absent-reason"
http://terminology.hl7.org/CodeSystem/diagnosis-role,1.1.1,active,"2.16.840.1.113883.4.642.1.1054",DiagnosisRole,Diagnosis Role,"This value set defines a set of codes that can be used to express the role of a diagnosis on the Encounter or EpisodeOfCare record.","ValueSet/diagnosis-role"
http://terminology.hl7.org/CodeSystem/diet,1.0.1,active,"2.16.840.1.113883.4.642.1.1091",Diet,Diet,"This value set defines a set of codes that can be used to indicate dietary preferences or restrictions a patient may have.","ValueSet/encounter-diet"
http://terminology.hl7.org/CodeSystem/discharge-disposition,1.0.1,active,"2.16.840.1.113883.4.642.1.1093",DischargeDisposition,Discharge disposition,"This value set defines a set of codes that can be used to where the patient left the hospital.","ValueSet/encounter-discharge-disposition"
http://terminology.hl7.org/CodeSystem/encounter-special-arrangements,1.0.1,active,"2.16.840.1.113883.4.642.1.1090",SpecialArrangements,Special arrangements,"This value set defines a set of codes that can be used to indicate the kinds of special arrangements in place for a patients visit.","ValueSet/encounter-special-arrangements"
http://terminology.hl7.org/CodeSystem/encounter-type,1.0.1,active,"2.16.840.1.113883.4.642.1.1088",EncounterType,Encounter type,"This example value set defines a set of codes that can be used to indicate the type of encounter: a specific code indicating type of service provided.","ValueSet/encounter-type"
http://terminology.hl7.org/CodeSystem/entformula-additive,1.0.1,active,"2.16.840.1.113883.4.642.1.1123",EnteralFormulaAdditiveTypeCode,Enteral Formula Additive Type Code,"EnteralFormulaAdditiveType: Codes for the type of modular component such as protein, carbohydrate or fiber to be provided in addition to or mixed with the base formula. This value set is provided as a suggestive example.","ValueSet/entformula-additive"
http://terminology.hl7.org/CodeSystem/episodeofcare-type,1.0.1,active,"2.16.840.1.113883.4.642.1.1189",EpisodeOfCareType,Episode of care type,"This example value set defines a set of codes that can be used to express the usage type of an EpisodeOfCare record.","ValueSet/episodeofcare-type"
http://terminology.hl7.org/CodeSystem/ex-USCLS,1.0.0,draft,"2.16.840.1.113883.4.642.1.1153",USCLSCodes,USCLS Codes,"This value set includes a smattering of USCLS codes.","ValueSet/service-uscls"
http://terminology.hl7.org/CodeSystem/ex-benefitcategory,1.0.1,active,"2.16.840.1.113883.4.642.1.1175",BenefitCategoryCodes,Benefit Category Codes,"This value set includes examples of Benefit Category codes.","ValueSet/ex-benefitcategory"
http://terminology.hl7.org/CodeSystem/ex-claimsubtype,1.0.1,active,"2.16.840.1.113883.4.642.1.1158",ExampleClaimSubTypeCodes,Example Claim SubType Codes,"This value set includes sample Claim SubType codes which are used to distinguish the claim types for example within type institutional there may be subtypes for emergency services, bed stay and transportation.","ValueSet/claim-subtype"
http://terminology.hl7.org/CodeSystem/ex-coverage-financial-exception,1.0.1,active,"2.16.840.1.113883.4.642.1.1329",ExampleCoverageFinancialExceptionCodes,Example Coverage Financial Exception Codes,"This value set includes Example Coverage Financial Exception Codes.","ValueSet/coverage-financial-exception"
http://terminology.hl7.org/CodeSystem/ex-diagnosis-on-admission,1.0.1,active,"2.16.840.1.113883.4.642.1.1170",ExampleDiagnosisOnAdmissionCodes,Example Diagnosis on Admission Codes,"This value set includes example Diagnosis on Admission codes.","ValueSet/ex-diagnosis-on-admission"
http://terminology.hl7.org/CodeSystem/ex-diagnosisrelatedgroup,1.0.1,active,"2.16.840.1.113883.4.642.1.1166",ExampleDiagnosisRelatedGroupCodes,Example Diagnosis Related Group Codes,"This value set includes example Diagnosis Related Group codes.","ValueSet/ex-diagnosisrelatedgroup"
