URL,Version,Status,OIDs,Name,Title,Description,Used
http://terminology.hl7.org/CodeSystem/ex-diagnosistype,1.0.1,active,"2.16.840.1.113883.4.642.1.1167",ExampleDiagnosisTypeCodes,Example Diagnosis Type Codes,"This value set includes example Diagnosis Type codes.","ValueSet/ex-diagnosistype"
http://terminology.hl7.org/CodeSystem/ex-paymenttype,1.0.1,active,"2.16.840.1.113883.4.642.1.1181",ExamplePaymentTypeCodes,Example Payment Type Codes,"This value set includes example Payment Type codes.","ValueSet/ex-paymenttype"
http://terminology.hl7.org/CodeSystem/ex-procedure-type,1.0.1,active,"2.16.840.1.113883.4.642.1.1388",ExampleProcedureTypeCodes,Example Procedure Type Codes,"This value set includes example Procedure Type codes.","ValueSet/ex-procedure-type"
http://terminology.hl7.org/CodeSystem/ex-programcode,1.0.1,active,"2.16.840.1.113883.4.642.1.1161",ExampleProgramReasonCodes,Example Program Reason Codes,"This value set includes sample Program Reason Span codes.","ValueSet/ex-program-code"
http://terminology.hl7.org/CodeSystem/ex-providerqualification,1.0.1,active,"2.16.840.1.113883.4.642.1.1160",ExampleProviderQualificationCodes,Example Provider Qualification Codes,"This value set includes sample Provider Qualification codes.","ValueSet/provider-qualification"
http://terminology.hl7.org/CodeSystem/ex-relatedclaimrelationship,1.0.1,active,"2.16.840.1.113883.4.642.1.1159",ExampleRelatedClaimRelationshipCodes,Example Related Claim Relationship Codes,"This value set includes sample Related Claim Relationship codes.","ValueSet/related-claim-relationship"
http://terminology.hl7.org/CodeSystem/ex-revenue-center,1.0.1,active,"2.16.840.1.113883.4.642.1.1168",ExampleRevenueCenterCodes,Example Revenue Center Codes,"This value set includes sample Revenue Center codes.","ValueSet/ex-revenue-center"
http://terminology.hl7.org/CodeSystem/ex-serviceplace,1.0.1,active,"2.16.840.1.113883.4.642.1.1157",ExampleServicePlaceCodes,Example Service Place Codes,"This value set includes a smattering of Service Place codes.","ValueSet/service-place"
http://terminology.hl7.org/CodeSystem/ex-tooth,1.0.0,draft,"2.16.840.1.113883.4.642.1.1152",OralSiteCodes,Oral Site Codes,"This value set includes a smattering of FDI oral site codes.","ValueSet/tooth"
http://terminology.hl7.org/CodeSystem/forms-codes,1.0.1,active,"2.16.840.1.113883.4.642.1.1052",FormCodes,Form Codes,"This value set includes a sample set of Forms codes.","ValueSet/forms"
http://terminology.hl7.org/CodeSystem/fundsreserve,1.0.1,active,"2.16.840.1.113883.4.642.1.1051",FundsReservationCodes,Funds Reservation Codes,"This value set includes sample funds reservation type codes.","ValueSet/fundsreserve"
http://terminology.hl7.org/CodeSystem/goal-achievement,1.0.1,active,"2.16.840.1.113883.4.642.1.1375",GoalAchievementStatus,Goal achievement status,"Describes the progression, or lack thereof, towards the goal against the target.","ValueSet/goal-achievement"
http://terminology.hl7.org/CodeSystem/goal-category,2.0.0,active,"2.16.840.1.113883.4.642.1.1097",GoalCategory,Goal category,"Codes for grouping goals to use for filtering or presentation.","ValueSet/goal-category"
http://terminology.hl7.org/CodeSystem/goal-priority,1.0.1,active,"2.16.840.1.113883.4.642.1.1096",GoalPriority,Goal priority,"Indicates the level of importance associated with reaching or sustaining a goal.","ValueSet/goal-priority"
http://terminology.hl7.org/CodeSystem/history-absent-reason,1.0.1,active,"2.16.840.1.113883.4.642.1.1094",FamilyHistoryAbsentReason,FamilyHistoryAbsentReason,"Codes describing the reason why a family member's history is not available.","ValueSet/history-absent-reason"
http://terminology.hl7.org/CodeSystem/immunization-funding-source,1.0.1,active,"2.16.840.1.113883.4.642.1.1100",ImmunizationFundingSource,Immunization Funding Source,"The value set to instantiate this attribute should be drawn from a terminologically robust code system that consists of or contains concepts to support describing the source of the vaccine administered. This value set is provided as a suggestive example.","ValueSet/immunization-funding-source"
http://terminology.hl7.org/CodeSystem/immunization-origin,1.0.1,active,"2.16.840.1.113883.4.642.1.1101",ImmunizationOriginCodes,Immunization Origin Codes,"The value set to instantiate this attribute should be drawn from a terminologically robust code system that consists of or contains concepts to support describing the source of the data when the report of the immunization event is not based on information from the person, entity or organization who administered the vaccine. This value set is provided as a suggestive example.","ValueSet/immunization-origin"
http://terminology.hl7.org/CodeSystem/immunization-program-eligibility,1.0.1,active,"2.16.840.1.113883.4.642.1.1099",ImmunizationProgramEligibility,Immunization Program Eligibility,"The value set to instantiate this attribute should be drawn from a terminologically robust code system that consists of or contains concepts to support describing the patient's eligibility for a vaccination program. This value set is provided as a suggestive example.","ValueSet/immunization-program-eligibility"
http://terminology.hl7.org/CodeSystem/immunization-subpotent-reason,1.0.1,active,"2.16.840.1.113883.4.642.1.1098",ImmunizationSubpotentReason,Immunization Subpotent Reason,"The value set to instantiate this attribute should be drawn from a terminologically robust code system that consists of or contains concepts to support describing the reason why a dose is considered to be subpotent. This value set is provided as a suggestive example.","ValueSet/immunization-subpotent-reason"
http://terminology.hl7.org/CodeSystem/list-empty-reason,1.0.1,active,"2.16.840.1.113883.4.642.1.1106",ListEmptyReasons,List Empty Reasons,"General reasons for a list to be empty. Reasons are either related to a summary list (i.e. problem or medication list) or to a workflow related list (i.e. consultation list).","ValueSet/list-empty-reason"
http://terminology.hl7.org/CodeSystem/list-example-use-codes,1.0.1,active,"2.16.840.1.113883.4.642.1.1105",ExampleUseCodesForList,Example Use Codes for List,"Example use codes for the List resource - typical kinds of use.","ValueSet/list-example-codes"
http://terminology.hl7.org/CodeSystem/list-order,2.0.0,active,"2.16.840.1.113883.4.642.1.1107",ListOrderCodes,List Order Codes,"Base values for the order of item lists in resources.","ValueSet/list-order"
http://terminology.hl7.org/CodeSystem/location-physical-type,2.0.1,active,"2.16.840.1.113883.4.642.1.1108",LocationType,Location type,"This example value set defines a set of codes that can be used to indicate the physical form of the Location.  This includes several 'non physical' codes which are still considered a location.","ValueSet/location-physical-type"
http://terminology.hl7.org/CodeSystem/med-admin-perform-function,1.0.1,active,"2.16.840.1.113883.4.642.1.1112",MedicationAdministrationPerformerFunctionCodes,MedicationAdministration Performer Function Codes,"MedicationAdministration Performer Function Codes","ValueSet/med-admin-perform-function"
http://terminology.hl7.org/CodeSystem/medication-admin-category,4.0.1,draft,"2.16.840.1.113883.4.642.4.1111",MedicationAdministration Category Codes,Medication administration  category  codes,"MedicationAdministration Category Codes","ValueSet/medication-admin-category"
http://terminology.hl7.org/CodeSystem/medication-admin-status,4.0.1,draft,"2.16.840.1.113883.4.642.4.1311",MedicationAdministration Status Codes,Medication administration  status  codes,"MedicationAdministration Status Codes","ValueSet/medication-admin-status"
http://terminology.hl7.org/CodeSystem/medication-statement-category,4.0.1,draft,"2.16.840.1.113883.4.642.4.1120",Medication usage category codes,Medication usage category codes,"Medication Status Codes","ValueSet/medication-statement-category"
http://terminology.hl7.org/CodeSystem/medicationdispense-performer-function,1.0.1,active,"2.16.840.1.113883.4.642.1.1319",MedicationDispensePerformerFunctionCodes,MedicationDispense Performer Function Codes,"MedicationDispense Performer Function Codes","ValueSet/medicationdispense-performer-function"
http://terminology.hl7.org/CodeSystem/medicationdispense-status,4.0.1,draft,"2.16.840.1.113883.4.642.4.1313",MedicationDispense Status Codes,Medication dispense  status  codes,"MedicationDispense Status Codes","ValueSet/medicationdispense-status"
http://terminology.hl7.org/CodeSystem/medicationrequest-category,1.0.0,draft,"2.16.840.1.113883.4.642.1.1323",MedicationRequestCategoryCodes,MedicationRequest Category Codes,"MedicationRequest Category Codes","ValueSet/medicationrequest-category"
http://terminology.hl7.org/CodeSystem/medicationrequest-course-of-therapy,1.0.1,active,"2.16.840.1.113883.4.642.1.1327",MedicationRequestCourseOfTherapyCodes,MedicationRequest Course of Therapy Codes,"MedicationRequest Course of Therapy Codes","ValueSet/medicationrequest-course-of-therapy"
http://terminology.hl7.org/CodeSystem/medicationrequest-status-reason,1.0.1,active,"2.16.840.1.113883.4.642.1.1325",MedicationRequestStatusReasonCodes,MedicationRequest Status Reason Codes,"MedicationRequest Status Reason Codes","ValueSet/medicationrequest-status-reason"
http://terminology.hl7.org/CodeSystem/missingtoothreason,1.0.1,active,"2.16.840.1.113883.4.642.1.1150",MissingToothReasonCodes,Missing Tooth Reason Codes,"This value set includes sample Missing Tooth Reason codes.","ValueSet/missing-tooth-reason"
http://terminology.hl7.org/CodeSystem/modifiers,1.0.1,active,"2.16.840.1.113883.4.642.1.1151",ModifierTypeCodes,Modifier type Codes,"This value set includes sample Modifier type codes.","ValueSet/claim-modifiers"
http://terminology.hl7.org/CodeSystem/observation-category,2.0.0,active,"2.16.840.1.113883.4.642.1.1125",ObservationCategoryCodes,Observation Category Codes,"Observation Category codes.","ValueSet/observation-category"
http://terminology.hl7.org/CodeSystem/operation-outcome,3.0.0,draft,"2.16.840.1.113883.4.642.1.1127",OperationOutcomeCodes,Operation Outcome Codes,"Operation Outcome codes used by FHIR test servers (see Implementation file translations.xml)","ValueSet/operation-outcome"
http://terminology.hl7.org/CodeSystem/organization-type,2.0.1,active,"2.16.840.1.113883.4.642.1.1128",OrganizationType,Organization type,"This example value set defines a set of codes that can be used to indicate a type of organization.","ValueSet/organization-type"
http://terminology.hl7.org/CodeSystem/participant-type,1.0.1,active,"2.16.840.1.113883.4.642.1.1089",ParticipantType,Participant type,"This value set defines a set of codes that can be used to indicate how an individual participates in an encounter.","ValueSet/encounter-participant-type"
http://terminology.hl7.org/CodeSystem/payeetype,1.0.1,active,"2.16.840.1.113883.4.642.1.1050",ClaimPayeeTypeCodes,Payee Type Codes,"Codes indicating the type of party to be reimbursed for cost of products and services.","ValueSet/payeetype"
http://terminology.hl7.org/CodeSystem/payment-adjustment-reason,1.0.1,active,"2.16.840.1.113883.4.642.1.1173",PaymentAdjustmentReasonCodes,Payment Adjustment Reason Codes,"This value set includes smattering of Payment Adjustment Reason codes.","ValueSet/payment-adjustment-reason"
http://terminology.hl7.org/CodeSystem/payment-type,1.0.1,active,"2.16.840.1.113883.4.642.1.1186",PaymentTypeCodes,Payment Type Codes,"This value set includes sample Payment Type codes.","ValueSet/payment-type"
http://terminology.hl7.org/CodeSystem/paymentstatus,1.0.1,active,"2.16.840.1.113883.4.642.1.1187",PaymentStatusCodes,Payment Status Codes,"This value set includes a sample set of Payment Status codes.","ValueSet/payment-status"
http://terminology.hl7.org/CodeSystem/practitioner-role,1.0.1,active,"2.16.840.1.113883.4.642.1.1132",PractitionerRole,Practitioner role,"This example value set defines a set of codes that can be used to indicate the role of a Practitioner.","ValueSet/practitioner-role"
http://terminology.hl7.org/CodeSystem/processpriority,1.0.1,active,"2.16.840.1.113883.4.642.1.1155",ProcessPriorityCodes,Process Priority Codes,"This value set includes the financial processing priority codes.","ValueSet/process-priority"
http://terminology.hl7.org/CodeSystem/program,1.0.1,active,"2.16.840.1.113883.4.642.1.1384",Program,Program,"This value set defines an example set of codes that could be can be used to classify groupings of service-types/specialties.","ValueSet/program"
http://terminology.hl7.org/CodeSystem/reason-medication-given,1.0.1,active,"2.16.840.1.113883.4.642.1.1110",ReasonMedicationGivenCodes,Reason Medication Given Codes,"This value set is provided as an example. The value set to instantiate this attribute should be drawn from a robust terminology code system that consists of or contains concepts to support the medication process.","ValueSet/reason-medication-given-codes"
http://terminology.hl7.org/CodeSystem/referencerange-meaning,1.0.1,active,"2.16.840.1.113883.4.642.1.1124",ObservationReferenceRangeMeaningCodes,Observation Reference Range Meaning Codes,"This value set defines a set of codes that can be used to indicate the meaning/use of a reference range for a particular target population.","ValueSet/referencerange-meaning"
http://terminology.hl7.org/CodeSystem/risk-probability,1.0.1,active,"2.16.840.1.113883.4.642.1.1133",RiskProbability,Risk Probability,"Codes representing the likelihood of a particular outcome in a risk assessment.","ValueSet/risk-probability"
http://terminology.hl7.org/CodeSystem/service-category,1.1.1,active,"2.16.840.1.113883.4.642.1.1144",ServiceCategory,Service category,"This value set defines an example set of codes that can be used to classify groupings of service-types/specialties.","ValueSet/service-category"
http://terminology.hl7.org/CodeSystem/service-provision-conditions,1.0.1,active,"2.16.840.1.113883.4.642.1.1143",ServiceProvisionConditions,ServiceProvisionConditions,"The code(s) that detail the conditions under which the healthcare service is available/offered.","ValueSet/service-provision-conditions"
http://terminology.hl7.org/CodeSystem/service-referral-method,1.0.1,active,"2.16.840.1.113883.4.642.1.1142",ReferralMethod,ReferralMethod,"The methods of referral can be used when referring to a specific HealthCareService resource.","ValueSet/service-referral-method"
http://terminology.hl7.org/CodeSystem/service-type,1.1.1,active,"2.16.840.1.113883.4.642.1.1145",ServiceType,Service type,"This value set defines an example set of codes of service-types.","ValueSet/service-type"
http://terminology.hl7.org/CodeSystem/subscriber-relationship,1.0.1,active,"2.16.840.1.113883.4.642.1.1386",SubscriberRelationshipCodes,SubscriberPolicyholder Relationship Codes,"This value set includes codes for the relationship between the Subscriber and the Beneficiary (insured/covered party/patient).","ValueSet/subscriber-relationship"
http://terminology.hl7.org/CodeSystem/substance-category,1.0.1,active,"2.16.840.1.113883.4.642.1.1138",SubstanceCategoryCodes,Substance Category Codes,"Substance category codes","ValueSet/substance-category"
http://terminology.hl7.org/CodeSystem/v2-0074,3.0.0,active,"2.16.840.1.113883.18.29",DiagnosticServiceSectionId,diagnosticServiceSectionId,"HL7-defined code system of concepts which specify a section of a diagnostic service where the observation may be performed.  Used in HL7 Version 2.x messaging in the OBR and OM4 segments.","ValueSet/diagnostic-service-sections"
http://terminology.hl7.org/CodeSystem/v2-0092,3.0.0,active,"2.16.840.1.113883.18.36",ReAdmissionIndicator,re-admissionIndicator,"Code system of concepts which are used to specify that a patient is being re admitted to a healthcare facilityin from which they were discharged, and indicates the circumstances around such re-admission.  Used in HL7 Version 2.x messagine in the PV1 segment.","ValueSet/v2-0092"
http://terminology.hl7.org/CodeSystem/v2-0116,3.0.0,active,"2.16.840.1.113883.18.47",BedStatus,bedStatus,"Code system of concepts which specify the state of a bed in an inpatient setting, and is used to determine if a patient may be assigned to it or not.  Used in HL7 Version 2.x messaging in the DLD and PV1 segments.","ValueSet/v2-0116"
http://terminology.hl7.org/CodeSystem/v2-0131,3.0.0,active,"2.16.840.1.113883.18.58",ContactRole2,contactRole2,"Code system of concepts which specify a relationship role that the next of kin/associated parties plays with regard to the patient. Also used in referrals, for example, it may be necessary to identify the contact representative at the clinic that sent a referral. Used in HL7 Version 2 messaging in the NK1 and CTD segments after 2.5, when it replace 2.16.840.1.113883.18.57.","ValueSet/relatedperson-relationshiptype,ValueSet/patient-contactrelationship"
http://terminology.hl7.org/CodeSystem/v2-0203,5.0.0,active,"2.16.840.1.113883.18.108",IdentifierType,identifierType,"HL7-defined code system of concepts specifying type of identifier. Used in HL7 Version 2.x messaging data types CX, PLN, PPN, XCN and XON.","ValueSet/identifier-type"
http://terminology.hl7.org/CodeSystem/v2-0371,3.0.0,active,"2.16.840.1.113883.18.229",AdditivePreservative,additivePreservative,"HL7-defined code system of concepts specifying any additive introduced to the specimen before or at the time of collection.  These additives may be introduced in order to preserve, maintain or enhance the particular nature or component of the specimen.  Used in HL7 Version 2.x messaging in the SPM and SAC segments.","ValueSet/v2-0371"
http://terminology.hl7.org/CodeSystem/v2-0373,3.0.0,active,"2.16.840.1.113883.18.231",Treatment,treatment,"Code system of concepts that identify the specimen treatment performed during lab processing.  Used in the Interaction Specimen Container Detail (SAC) segment in HL7 Version 2.x messaging.","ValueSet/specimen-processing-procedure"
http://terminology.hl7.org/CodeSystem/v2-0443,3.0.0,active,"2.16.840.1.113883.18.283",ProviderRole,providerRole,"Code system of concepts specifying the functional involvement with the activity being transmitted (e.g., Case Manager, Evaluator, Transcriber, Nurse Care Practitioner, Midwife, Physician Assistant, etc.).  Used in HL7 Version 2.x messaging in the ROL segment.","ValueSet/immunization-function"
http://terminology.hl7.org/CodeSystem/v2-0487,3.0.0,active,"2.16.840.1.113883.18.311",SpecimenType,specimenType,"HL7-defined code system of concepts that describe the precise nature of an entity that may be used as the source material for an observation.  This is one of two code systems that are used instead of table 0070 (code system 2.16.840.1.113883.18.28) which conflated specimen types and specimen collection methods.   Used in HL7 Version 2.x messaging in the SPM segment.","ValueSet/v2-0487"
http://terminology.hl7.org/CodeSystem/v2-0493,3.0.0,active,"2.16.840.1.113883.18.317",SpecimenCondition,specimenCondition,"Code system of concepts specifying a mode or state of being that describes the nature of the specimen.  Used in HL7 Version 2.x messaging in the SPM segment.","ValueSet/v2-0493"
http://terminology.hl7.org/CodeSystem/v2-0916,3.0.0,active,"2.16.840.1.113883.18.422",RelevantClincialInformation,relevantClincialInformation,"Code system of concepts specifying additional clinical information about the patient or specimen to report the supporting and/or suspected diagnosis and clinical findings on requests for interpreted diagnostic studies. Used in HL7 Version 2.x messaging in the OBR segment.","ValueSet/v2-0916"
http://terminology.hl7.org/CodeSystem/v3-ActCode,9.0.0,active,"2.16.840.1.113883.5.4",ActCode,ActCode,"A code specifying the particular kind of Act that the Act-instance represents within its class.    *Constraints:* The kind of Act (e.g. physical examination, serum potassium, inpatient encounter, charge financial transaction, etc.) is specified with a code from one of several, typically external, coding systems. The coding system will depend on the class of Act, such as LOINC for observations, etc.    Conceptually, the Act.code must be a specialization of the Act.classCode. This is why the structure of ActClass domain should be reflected in the superstructure of the ActCode domain and then individual codes or externally referenced vocabularies subordinated under these domains that reflect the ActClass structure.    Act.classCode and Act.code are not modifiers of each other but the Act.code concept should really imply the Act.classCode concept. For a negative example, it is not appropriate to use an Act.code ""potassium"" together with and Act.classCode for ""laboratory observation"" to somehow mean ""potassium laboratory observation"" and then use the same Act.code for ""potassium"" together with Act.classCode for ""medication"" to mean ""substitution of potassium"". This mutually modifying use of Act.code and Act.classCode is not permitted.","ValueSet/v3-ActPharmacySupplyType,ValueSet/account-type,ValueSet/v3-ActIncidentCode,ValueSet/v3-ActCode,ValueSet/v3-ActEncounterCode"
http://terminology.hl7.org/CodeSystem/v3-ActPriority,3.0.0,active,"2.16.840.1.113883.5.7",ActPriority,ActPriority,"A set of codes (e.g., for routine, emergency), specifying the urgency under which the Act happened, can happen, is happening, is intended to happen, or is requested/demanded to happen.","ValueSet/v3-ActPriority"
http://terminology.hl7.org/CodeSystem/v3-ActReason,3.1.0,active,"2.16.840.1.113883.5.8",ActReason,ActReason,"A set of codes specifying the motivation, cause, or rationale of an Act, when such rationale is not reasonably represented as an ActRelationship of type ""has reason"" linking to another Act.    *Examples:* Example reasons that might qualify for being coded in this field might be: ""routine requirement"", ""infectious disease reporting requirement"", ""on patient request"", ""required by law"".","ValueSet/immunization-status-reason,ValueSet/v3-SubstanceAdminSubstitutionReason"
http://terminology.hl7.org/CodeSystem/v3-ActSite,3.0.0,active,"2.16.840.1.113883.5.1052",ActSite,ActSite,"An anatomical location on an organism which can be the focus of an act.","ValueSet/immunization-site"
http://terminology.hl7.org/CodeSystem/v3-Confidentiality,3.0.0,active,"2.16.840.1.113883.5.25",Confidentiality,Confidentiality,"A set of codes specifying the security classification of acts and roles in accordance with the definition for concept domain ""Confidentiality"".","ValueSet/v3-ConfidentialityClassification"
http://terminology.hl7.org/CodeSystem/v3-EncounterSpecialCourtesy,3.0.0,active,"2.16.840.1.113883.5.40",EncounterSpecialCourtesy,EncounterSpecialCourtesy,"**** MISSING DESCRIPTION ****","ValueSet/encounter-special-courtesy"
http://terminology.hl7.org/CodeSystem/v3-MaritalStatus,3.0.0,active,"2.16.840.1.113883.5.2",MaritalStatus,MaritalStatus,"\* \* \* No description supplied \* \* \*    *Open Issue:* The specific meanings of these codes can vary somewhat by jurisdiction and implementation so caution should be used when determining equivalency.    *Open Issue:* fixing and completion of the hierarchy and proper good definitions of all the concepts is badly needed.","ValueSet/marital-status"
http://terminology.hl7.org/CodeSystem/v3-NullFlavor,3.0.0,active,"2.16.840.1.113883.5.1008",NullFlavor,NullFlavor,"A collection of codes specifying why a valid value is not present.","ValueSet/marital-status,ValueSet/encounter-special-courtesy"
http://terminology.hl7.org/CodeSystem/v3-ObservationInterpretation,3.0.0,active,"2.16.840.1.113883.5.83",ObservationInterpretation,ObservationInterpretation,"One or more codes providing a rough qualitative interpretation of the observation, such as ""normal"" / ""abnormal"", ""low"" / ""high"", ""better"" / ""worse"", ""resistant"" / ""susceptible"", ""expected"" / ""not expected"". The value set is intended to be for ANY use where coded representation of an interpretation is needed.","ValueSet/observation-interpretation"
http://terminology.hl7.org/CodeSystem/v3-ParticipationType,5.0.0,active,"2.16.840.1.113883.5.90",ParticipationType,ParticipationType,"A code specifying the meaning and purpose of every Participation instance. Each of its values implies specific constraints on the Roles undertaking the participation.","ValueSet/series-performer-function,ValueSet/encounter-participant-type"
http://terminology.hl7.org/CodeSystem/v3-ReligiousAffiliation,3.0.0,active,"2.16.840.1.113883.5.1076",ReligiousAffiliation,Religious Affiliation,"Assigment of spiritual faith affiliation","ValueSet/v3-ReligiousAffiliation"
http://terminology.hl7.org/CodeSystem/v3-RoleCode,3.0.0,active,"2.16.840.1.113883.5.111",RoleCode,RoleCode,"A set of codes further specifying the kind of Role; specific classification codes for further qualifying RoleClass codes.","ValueSet/relatedperson-relationshiptype,ValueSet/v3-FamilyMember,ValueSet/v3-ServiceDeliveryLocationRoleType"
http://terminology.hl7.org/CodeSystem/v3-RouteOfAdministration,3.0.0,active,"2.16.840.1.113883.5.112",RouteOfAdministration,RouteOfAdministration,"The path the administered medication takes to get into the body or into contact with the body.","ValueSet/enteral-route,ValueSet/immunization-route"
http://terminology.hl7.org/CodeSystem/v3-substanceAdminSubstitution,3.0.0,active,"2.16.840.1.113883.5.1070",SubstanceAdminSubstitution,Substance Admin Substitution,"Identifies what sort of change is permitted or has occurred between the therapy that was ordered and the therapy that was/will be provided.","ValueSet/v3-ActSubstanceAdminSubstitutionCode"
http://terminology.hl7.org/fhir/CodeSystem/medicationdispense-category,4.0.1,draft,"2.16.840.1.113883.4.642.4.1315",MedicationDispense Category Codes,Medication dispense  category  codes,"MedicationDispense Category Codes","ValueSet/medicationdispense-category"
